{
  "$schema": "https://json-schema.org/draft/2020-12/schema",
  "$id": "https://pocketjs.dev/schema/pocket-2.json",
  "title": "Pocket application manifest, format 2",
  "type": "object",
  "additionalProperties": false,
  "required": [
    "$schema",
    "pocket",
    "id",
    "name",
    "title",
    "version",
    "engine",
    "app"
  ],
  "properties": {
    "$schema": {
      "const": "https://pocketjs.dev/schema/pocket-2.json"
    },
    "pocket": {
      "const": 2
    },
    "id": {
      "type": "string",
      "minLength": 3,
      "pattern": "^[a-z0-9](?:[a-z0-9-]*[a-z0-9])?(?:\\.[a-z0-9](?:[a-z0-9-]*[a-z0-9])?)+$"
    },
    "name": {
      "type": "string",
      "minLength": 1,
      "maxLength": 64,
      "pattern": "^[a-z][a-z0-9]*(?:-[a-z0-9]+)*$"
    },
    "title": {
      "type": "string",
      "minLength": 1,
      "maxLength": 128
    },
    "version": {
      "type": "string",
      "pattern": "^(0|[1-9][0-9]*)\\.(0|[1-9][0-9]*)\\.(0|[1-9][0-9]*)(?:-[0-9A-Za-z-]+(?:\\.[0-9A-Za-z-]+)*)?(?:\\+[0-9A-Za-z-]+(?:\\.[0-9A-Za-z-]+)*)?$"
    },
    "engine": {
      "type": "object",
      "additionalProperties": false,
      "required": [
        "capabilities"
      ],
      "properties": {
        "capabilities": {
          "type": "object",
          "additionalProperties": false,
          "required": [
            "requires"
          ],
          "properties": {
            "requires": {
              "type": "array",
              "items": {
                "type": "string",
                "pattern": "^[a-z][a-z0-9-]*(?:\\.[a-z][a-z0-9-]*)+$"
              },
              "minItems": 1,
              "uniqueItems": true
            },
            "enhances": {
              "type": "array",
              "items": {
                "type": "string",
                "pattern": "^[a-z][a-z0-9-]*(?:\\.[a-z][a-z0-9-]*)+$"
              },
              "uniqueItems": true
            }
          }
        }
      }
    },
    "app": {
      "type": "object",
      "additionalProperties": false,
      "required": [
        "entry",
        "framework",
        "viewport"
      ],
      "properties": {
        "entry": {
          "type": "string",
          "minLength": 1,
          "pattern": "^(?!/)(?!.*(?:^|/)\\.\\.(?:/|$))(?!.*\\\\).+\\.tsx?$"
        },
        "output": {
          "type": "string",
          "minLength": 1,
          "maxLength": 64,
          "pattern": "^[a-z][a-z0-9]*(?:-[a-z0-9]+)*$"
        },
        "framework": {
          "enum": [
            "solid",
            "vue-vapor"
          ]
        },
        "viewport": {
          "anyOf": [
            {
              "type": "object",
              "additionalProperties": false,
              "required": [
                "logical",
                "presentation"
              ],
              "properties": {
                "logical": {
                  "type": "array",
                  "items": {
                    "type": "integer",
                    "minimum": 1
                  },
                  "minItems": 2,
                  "maxItems": 2
                },
                "presentation": {
                  "enum": [
                    "fill",
                    "fit",
                    "integer-fit",
                    "native",
                    "stretch"
                  ]
                }
              }
            },
            {
              "type": "object",
              "additionalProperties": false,
              "properties": {
                "fixed": {
                  "type": "object",
                  "additionalProperties": false,
                  "required": [
                    "logical",
                    "presentation"
                  ],
                  "properties": {
                    "logical": {
                      "type": "array",
                      "items": {
                        "type": "integer",
                        "minimum": 1
                      },
                      "minItems": 2,
                      "maxItems": 2
                    },
                    "presentation": {
                      "enum": [
                        "fill",
                        "fit",
                        "integer-fit",
                        "native",
                        "stretch"
                      ]
                    }
                  }
                },
                "dynamic": {
                  "type": "object",
                  "additionalProperties": false,
                  "required": [
                    "default"
                  ],
                  "properties": {
                    "default": {
                      "type": "array",
                      "items": {
                        "type": "integer",
                        "minimum": 1
                      },
                      "minItems": 2,
                      "maxItems": 2
                    },
                    "min": {
                      "type": "array",
                      "items": {
                        "type": "integer",
                        "minimum": 1
                      },
                      "minItems": 2,
                      "maxItems": 2
                    },
                    "max": {
                      "type": "array",
                      "items": {
                        "type": "integer",
                        "minimum": 1
                      },
                      "minItems": 2,
                      "maxItems": 2
                    }
                  }
                }
              }
            }
          ]
        }
      }
    }
  }
}
