{
  "$schema": "https://pocketjs.dev/schema/pocket-2.json",
  "pocket": 2,
  "id": "dev.pocket-stack.d211-demo",
  "name": "pocketjs-d211-demo",
  "title": "PocketJS: D211 Linux",
  "version": "0.1.0",
  "engine": {
    "capabilities": {
      "requires": ["input.touch", "text.glyphs.baked"]
    }
  },
  "app": {
    "entry": "apps/d211-demo/main.tsx",
    "output": "d211-demo-main",
    "framework": "solid",
    "viewport": {
      "fixed": {
        "logical": [800, 480],
        "presentation": "native"
      }
    }
  }
}
