{
  "$schema": "https://pocketjs.dev/schema/pocket-2.json",
  "pocket": 2,
  "id": "dev.pocket-stack.cards",
  "name": "pocketjs-cards",
  "title": "PocketJS: Feature Cards",
  "version": "0.6.0",
  "engine": {
    "capabilities": {
      "requires": [
        "text.glyphs.baked",
        "input.buttons"
      ]
    }
  },
  "app": {
    "entry": "demos/cards/main.tsx",
    "output": "cards-main",
    "framework": "solid",
    "viewport": {
      "logical": [
        480,
        272
      ],
      "presentation": "integer-fit"
    }
  }
}
