{
  "$schema": "https://pocketjs.dev/schema/pocket-2.json",
  "pocket": 2,
  "id": "dev.pocket-stack.notifications",
  "name": "pocketjs-notifications",
  "title": "PocketJS: Notifications",
  "version": "0.6.0",
  "engine": {
    "capabilities": {
      "requires": [
        "text.glyphs.baked",
        "input.buttons"
      ]
    }
  },
  "app": {
    "entry": "apps/notifications/main.tsx",
    "output": "notifications-main",
    "framework": "solid",
    "viewport": {
      "fixed": {
        "logical": [
          480,
          272
        ],
        "presentation": "integer-fit"
      }
    }
  }
}
