{
  "$schema": "https://pocketjs.dev/schema/pocket-2.json",
  "pocket": 2,
  "id": "dev.pocket-stack.iphone16-demo",
  "name": "pocketjs-iphone16-hero",
  "title": "PocketJS: iPhone 16 Hero",
  "version": "0.1.0",
  "engine": {
    "capabilities": {
      "requires": ["input.touch", "text.glyphs.baked"]
    }
  },
  "app": {
    "entry": "apps/iphone16-demo/main.tsx",
    "output": "iphone16-demo-main",
    "framework": "solid",
    "viewport": {
      "fixed": {
        "logical": [480, 272],
        "presentation": "integer-fit"
      }
    }
  }
}
